{
  "$schema": "http://json-schema.org/draft-07/schema#",
  "$id": "https://spoke42.invalid/schemas/connect/connect-hello.schema.json",
  "title": "ConnectHello",
  "description": "Handshake envelope: signed self-description exchange (peer_id + embedded HostCapabilityManifest).",
  "type": "object",
  "required": [
    "protocol_version",
    "peer_id",
    "nonce",
    "host",
    "signature",
    "extensions"
  ],
  "properties": {
    "protocol_version": {
      "type": "integer",
      "minimum": 1,
      "description": "Connect protocol version (not data schema_version). Protocol version 1 is current."
    },
    "peer_id": {
      "type": "string",
      "minLength": 1,
      "description": "Sender network identity (opaque). Trust root for noise-peerid allowlist."
    },
    "nonce": {
      "type": "string",
      "minLength": 16,
      "description": "Single-use replay nonce. Bound into the signed object."
    },
    "host": {
      "$ref": "https://spoke42.invalid/schemas/data/host-capability-manifest.schema.json",
      "description": "Full embedded manifest (includes host.extensions). Part of the signed object."
    },
    "signature": {
      "type": "string",
      "minLength": 1,
      "description": "base64url (no padding) of raw signature bytes over the JCS-canonicalized signed object (spoke-connect-hello-jcs-v1)."
    },
    "extensions": {
      "$ref": "https://spoke42.invalid/schemas/common/common.schema.json#/definitions/ExtensionMap",
      "description": "Product bag; not covered by the signature."
    }
  },
  "additionalProperties": false
}
